source,title,raw_text,score,num_comments,post_obj,publishedAt,url,thumbnail,domain,engagement_score,sentiment,sentiment_label,comment_sentiments,comment_sentiments_label
reddit,Tiny lab-in-a-pill can monitor your gut health from the inside | This wireless pill that tracks your digestive system in real time could revolutionize gut health monitoring,tiny labinapill can monitor your gut health from the inside  this wireless pill that tracks your digestive system in real time could revolutionize gut health monitoring,394,23,1lxxzp8,2025-07-12T11:16:27,https://newatlas.com/imaging-diagnostics/pilltrek-caltech-monitor-gut-health-gi-tract/,"https://external-preview.redd.it/72KcsF1lqwfGWZZQqajXZMxGzKpDtSlmDnuwsbVwxSE.jpeg?width=140&height=73&crop=140:73,smart&auto=webp&s=a0c34e1b2e2831a2554c3b864d2e5d1e4b269b76",Tech,417,0.0,Neutral,0.0030600000000000093,Neutral
reddit,"Brain circuit identified that gives physical pain its emotional sting, explaining why some hurts linger as suffering | The breakthrough challenges our beliefs about how we process pain and may transform chronic pain treatments.",brain circuit identified that gives physical pain its emotional sting explaining why some hurts linger as suffering  the breakthrough challenges our beliefs about how we process pain and may transform chronic pain treatments,1098,46,1lx3puc,2025-07-11T10:48:52,https://newatlas.com/disease/brain-circuit-physical-emotional-pain/,"https://external-preview.redd.it/NkiDmAOOpifS5zP2hDC3Gmcfgkl4b0I-dSQD2ZByQIY.jpeg?width=140&height=73&crop=140:73,smart&auto=webp&s=a4545e50300976491079f315230536e9fcad48c7",Tech,1144,-0.9349,Negative,0.08365999999999998,Neutral
reddit,"Autonomous robot surgeon removes organs with 100% success rate | ""This advancement moves us from robots that can execute specific surgical tasks to robots that truly understand surgical procedures.""",autonomous robot surgeon removes organs with 100 success rate  this advancement moves us from robots that can execute specific surgical tasks to robots that truly understand surgical procedures,1369,192,1lwa2nu,2025-07-10T11:15:02,https://newatlas.com/robotics/worlds-first-robot-surgery/,"https://external-preview.redd.it/4oLVB37oCuhoF-NOzEtpQVzVxLfMbKxSE3OvEJNXhEQ.png?width=140&height=73&crop=140:73,smart&auto=webp&s=f50c17bb4eab3fe6660f67e5c2da41bc6983890c",Tech,1561,0.765,Positive,0.1921,Neutral
reddit,Ancient-fossil bioconcrete traps 142% more carbon – and it’s strong as hell,ancientfossil bioconcrete traps 142 more carbon  and its strong as hell,625,31,1lwchok,2025-07-10T13:17:24,https://newatlas.com/materials/bio-concrete-carbon-diatomaceous-earth/,"https://external-preview.redd.it/nfq-DfdaowEBKkY03pXfuGUC5q5X-IseyvVL46yGXl8.png?width=140&height=73&crop=140:73,smart&auto=webp&s=8ce7b4fab793cc868f0f1ba358fb02e280452b04",Tech,656,-0.3182,Neutral,-0.011540000000000009,Neutral
reddit,"MIT's smart implant dispenses life-saving drug when diabetics need it most | A glucagon implant features a drug reservoir sealed with an alloy that changes shape when heated, so it can dispense its contents on demand",mits smart implant dispenses lifesaving drug when diabetics need it most  a glucagon implant features a drug reservoir sealed with an alloy that changes shape when heated so it can dispense its contents on demand,141,2,1lwa1b2,2025-07-10T11:12:56,https://newatlas.com/medical-tech/mit-hypoglycemia-implant-dispenses-glucagon-diabetes/,"https://external-preview.redd.it/7LhdVKMyeRglbwrjdYAdF5X9iBQaj_obl2phOCKl8Q0.jpeg?width=140&height=73&crop=140:73,smart&auto=webp&s=6b6785c1e5a52a8373c9553a14af8593126ad229",Tech,143,0.296,Neutral,-0.26685000000000003,Neutral
reddit,"Scientists 3D print tumors for cancer research — TissueTinker using 3D bioprinting to create miniature models of healthy and diseased tissue for side-by-side comparison, backed by McGill",scientists 3d print tumors for cancer research  tissuetinker using 3d bioprinting to create miniature models of healthy and diseased tissue for sidebyside comparison backed by mcgill,511,14,1lvjx00,2025-07-09T14:16:17,https://www.tomshardware.com/3d-printing/scientists-3d-print-tumors-for-cancer-research-tissuetinker-using-3d-bioprinting-to-create-miniature-models-of-healthy-and-diseased-tissue-for-side-by-side-comparison-backed-by-mcgill,"https://external-preview.redd.it/a7w3TmRSWm292DBqFTz3Iqfdz1jHQwosceeST-M-lb8.jpeg?width=140&height=78&crop=140:78,smart&auto=webp&s=5b2d1bf0a5952566b5db8b76f7da82602eb1be1d",Tech,525,-0.128,Neutral,-0.27432,Neutral
reddit,"Simple scan lets you slow down aging and even prevent chronic disease | It didn't just predict cognitive impairment, accelerated brain atrophy and conversion to diagnosed dementia, it could also provide a risk factor for physical frailty, poor health, other future chronic diseases and mortality.",simple scan lets you slow down aging and even prevent chronic disease  it didnt just predict cognitive impairment accelerated brain atrophy and conversion to diagnosed dementia it could also provide a risk factor for physical frailty poor health other future chronic diseases and mortality,808,53,1lvfhio,2025-07-09T10:38:28,https://newatlas.com/brain/alzheimers-dementia/single-mri-scan/,"https://external-preview.redd.it/EaZJ5E8qtmrfUekS7q3ySR_IpjwNXDb5ScIpvMxdCZY.png?width=140&height=73&crop=140:73,smart&auto=webp&s=71f8dd064c38c40d048f1432bdae03004a73dd57",Tech,861,-0.6249,Negative,0.23692000000000002,Neutral
reddit,Study shows AI coding assistants actually slow down experienced developers,study shows ai coding assistants actually slow down experienced developers,30,5,1m20api,2025-07-17T06:31:40,https://www.techspot.com/news/108651-experienced-developers-working-ai-tools-take-longer-complete.html,"https://external-preview.redd.it/dTcs-ohazTMJqK9478XgnR3hsQRBUQFqJ9rZDZLM5aE.jpeg?width=140&height=93&crop=140:93,smart&auto=webp&s=036e7896dfe47676c4392cc4826bba04815c33c7",Tech,35,0.0,Neutral,-0.22556666666666667,Neutral
reddit,Hydration sensor alerts wearer to urgent water need,hydration sensor alerts wearer to urgent water need,614,141,1m19l90,2025-07-16T11:00:39,https://newatlas.com/wearables/hydration-sensor-wearable/,"https://external-preview.redd.it/Dso9KKGy0vAdZYR4L98-_yG3qX6JwdPGPTfzS9yePbc.jpeg?width=140&height=73&crop=140:73,smart&auto=webp&s=06ef8553a218ce2f3135e0afdad9e50ca6d13b42",Tech,755,0.2023,Neutral,-0.16866,Neutral
reddit,Scientists develop blood test that reveals how fast your organs are aging | The scientists found that an organ's biological age strongly predicts the risk of related diseases,scientists develop blood test that reveals how fast your organs are aging  the scientists found that an organs biological age strongly predicts the risk of related diseases,345,13,1m1bb9h,2025-07-16T12:30:00,https://www.techspot.com/news/108672-scientists-develop-blood-test-reveals-how-fast-organs.html,"https://external-preview.redd.it/UXNV1SCJES39mkdl84Weu4-JA6OcwCiA7IDuo4-2aqg.jpeg?width=140&height=93&crop=140:93,smart&auto=webp&s=bcdf2919eda032446f4e5d9f3f6de75c6a4beb45",Tech,358,0.0,Neutral,0.15206,Neutral
reddit,One treatable issue could dramatically improve life for adults with ADHD | Study calls for more attention to be paid to how treating sleep disorders can greatly improve wellbeing for people with ADHD.,one treatable issue could dramatically improve life for adults with adhd  study calls for more attention to be paid to how treating sleep disorders can greatly improve wellbeing for people with adhd,1651,204,1m0gmmh,2025-07-15T12:35:57,https://newatlas.com/adhd-autism/adhd-life-satisfaction-insomnia/,"https://external-preview.redd.it/WJIm9Wr3y5qXGN_KA4nQPMCQZ6Ry4Q9f3kIj30lAIGE.jpeg?width=140&height=73&crop=140:73,smart&auto=webp&s=85e4a5ae8ad8df9afb812594da53c6ffe874f6f7",Tech,1855,0.7264,Positive,0.30294,Neutral
reddit,"Alibaba-backed Moonshot releases new Kimi AI model that beats ChatGPT, Claude in coding — and it costs less",alibababacked moonshot releases new kimi ai model that beats chatgpt claude in coding  and it costs less,86,6,1m0wtqw,2025-07-15T23:11:14,https://www.cnbc.com/2025/07/14/alibaba-backed-moonshot-releases-kimi-k2-ai-rivaling-chatgpt-claude.html,"https://external-preview.redd.it/0_FBAWufqqOTn0mcZPRsZJsFSHO9y993GsJn8w3P0XM.jpeg?width=140&height=78&crop=140:78,smart&auto=webp&s=cafff595af1fb98eeaec3b6cd3174240673655c1",Tech,92,0.0,Neutral,0.3612,Neutral
reddit,A prosthesis driven by the nervous system helps people with amputation walk naturally,a prosthesis driven by the nervous system helps people with amputation walk naturally,316,9,1m0hmu0,2025-07-15T13:22:08,https://news.mit.edu/2024/prosthesis-helps-people-with-amputation-walk-naturally-0701,"https://external-preview.redd.it/IFpkhSUflUI5-lIAOq5RCovsOrHA5C7ZZ8Eviih_XPI.jpeg?width=140&height=93&crop=140:93,smart&auto=webp&s=0d65360bbf3910c01eed79de9b213177aef61e08",Tech,325,0.128,Neutral,-0.28615,Neutral
reddit,"Spy-grade storage drive self-destructs on demand just like in the movies | This industrial storage drive for computers and servers can physically destroy itself at the push of a button, so your secrets go up in smoke before they fall into the wrong hands.",spygrade storage drive selfdestructs on demand just like in the movies  this industrial storage drive for computers and servers can physically destroy itself at the push of a button so your secrets go up in smoke before they fall into the wrong hands,174,20,1m0ezti,2025-07-15T11:13:21,https://newatlas.com/computers/team-group-p250q-ssd-self-destructs/,"https://external-preview.redd.it/5i4qkSw2_Isi2y1SBzwsM5kU3xlWhZAqR4eD8ALO77c.jpeg?width=140&height=73&crop=140:73,smart&auto=webp&s=d7a293dd36a06b6cf945d4cc1df8b9f70b357cb1",Tech,194,-0.6808,Negative,-0.20163999999999999,Neutral
reddit,"Painless breast cancer scan promises accurate results in under a minute | Breast cancer claims hundreds of thousands of lives per year, but new screening methods are making it easier to detect it early",painless breast cancer scan promises accurate results in under a minute  breast cancer claims hundreds of thousands of lives per year but new screening methods are making it easier to detect it early,1249,51,1lzo4xb,2025-07-14T14:38:49,https://newatlas.com/cancer/painless-breast-cancer-scan-onetouch-pat-buffalo/,"https://external-preview.redd.it/8N3R3BTc-veroaRpoz5yZ5vUncQ7naYSLB4x6S6ZGQc.jpeg?width=140&height=73&crop=140:73,smart&auto=webp&s=2476a797036150610cb345705387cdc782016bf8",Tech,1300,0.1779,Neutral,-0.25592000000000004,Neutral
reddit,Scientists reportedly hiding AI text prompts in academic papers to receive positive peer reviews,scientists reportedly hiding ai text prompts in academic papers to receive positive peer reviews,754,31,1lzqe2f,2025-07-14T16:03:49,https://www.theguardian.com/technology/2025/jul/14/scientists-reportedly-hiding-ai-text-prompts-in-academic-papers-to-receive-positive-peer-reviews,"https://external-preview.redd.it/ha8dnrFxCJyZVEy9835FLNyW-M1Ol8c5ZtffHz3eiAA.jpeg?width=140&height=73&crop=140:73,smart&auto=webp&s=62e585efd167b1465ee319cd831aa5926cd7c073",Tech,785,0.34,Neutral,0.37784,Neutral
reddit,Weekly Parkinson’s injection would be a game-changer for patients | A slow-release Parkinson's injection would mean not taking pills multiple times a day,weekly parkinsons injection would be a gamechanger for patients  a slowrelease parkinsons injection would mean not taking pills multiple times a day,877,13,1lzidi4,2025-07-14T09:59:15,https://newatlas.com/disease/weekly-injectable-implant-parkinsons/,"https://external-preview.redd.it/_CwN3wn-dgNjle-E2N7NomDtQ2Hi6qKS7USXJIsnFKU.jpeg?width=140&height=73&crop=140:73,smart&auto=webp&s=b570edee28976436c7f1ca36e62fbbeb296ae1e9",Tech,890,0.0,Neutral,0.15008000000000002,Neutral
reddit,Holographic ribbon challenges magnetic tape with 50-year longevity and 200TB cartridges | British startup unveils holographic tape that promises 50-year data lifespan,holographic ribbon challenges magnetic tape with 50year longevity and 200tb cartridges  british startup unveils holographic tape that promises 50year data lifespan,171,5,1lzsaog,2025-07-14T17:14:13,https://www.techspot.com/news/108655-holographic-ribbon-challenges-magnetic-tape-50-year-longevity.html,"https://external-preview.redd.it/PkyiU2iMCXMZzRFWEa8eyAgmtN8tqOU6COWJVRmaRcE.jpeg?width=140&height=109&crop=140:109,smart&auto=webp&s=a4137cd3fa77bc4304ae8d716db987281ec0fa7f",Tech,176,0.4404,Neutral,0.31245,Neutral
reddit,DARPA Sets New Record for Wireless Power Beaming | The latest effort beamed 800 watts over 8.6 kilometers,darpa sets new record for wireless power beaming  the latest effort beamed 800 watts over 86 kilometers,308,36,1lzizlo,2025-07-14T10:36:51,https://spectrum.ieee.org/darpa-optical-wireless-power,"https://external-preview.redd.it/_X07bVbKRrZsEQNkSB-kXvFFWzZrzDfByBw39WR--JA.jpeg?width=140&height=70&crop=140:70,smart&auto=webp&s=5d25ccc97bb324650e12dd299300da8dc2036d1d",Tech,344,-0.3818,Neutral,0.209,Neutral
reddit,DARPA greenlights Bell's rotor-folding X-plane,darpa greenlights bells rotorfolding xplane,179,16,1lzm0iq,2025-07-14T13:11:18,https://newatlas.com/military/bell-gets-darpa-green-light-build-jet-rotor-x-plane/,"https://external-preview.redd.it/f6DTP7tFhj5HUkJ98r7HQPfMPSIUyo1iToR1KU9nJGs.png?width=140&height=73&crop=140:73,smart&auto=webp&s=a430fb1017748ba83c3bcfd35048d9daceb71e87",Tech,195,0.0,Neutral,0.0,Neutral
reddit,China successfully tests home-grown OS in space to reduce foreign software dependence,china successfully tests homegrown os in space to reduce foreign software dependence,739,24,1lz7ziu,2025-07-14T00:08:08,https://www.yahoo.com/news/china-successfully-tests-home-grown-170131750.html,"https://external-preview.redd.it/6ddzcukgjISuDMsArsANRADwfvJ0t-dzirHcw79zz8w.png?width=140&height=78&crop=140:78,smart&auto=webp&s=ee4567e852fbfc9433b79a419a85c5f3b5c93db3",Tech,763,0.4939,Neutral,0.37560000000000004,Neutral
reddit,'Junk' RNA molecules help to regrow damaged nerves | The discovery could unlock new ways to treat nerve injuries and even restore growth in the brain and spinal cord.,junk rna molecules help to regrow damaged nerves  the discovery could unlock new ways to treat nerve injuries and even restore growth in the brain and spinal cord,1455,35,1lyrivl,2025-07-13T12:24:42,https://newatlas.com/medical-tech/rna-molecules-regenerate-neurons-mice/,"https://external-preview.redd.it/UctarnPWG9v5g-L2FXL3GLD266irv1gIAQA04_oNiic.jpeg?width=140&height=73&crop=140:73,smart&auto=webp&s=3b971f1aab34c55e74b1bee1345c0a35a6f95d40",Tech,1490,0.7096,Positive,0.24154,Neutral
reddit,A bionic knee integrated into tissue can restore natural movement,a bionic knee integrated into tissue can restore natural movement,486,23,1lysu4t,2025-07-13T13:28:40,https://news.mit.edu/2025/bionic-knee-integrated-into-tissue-can-restore-natural-movement-0710,"https://external-preview.redd.it/QrutBnbK9RehXEbsUqyv3gWL75QPGJJHz60fW4wshg0.jpeg?width=140&height=93&crop=140:93,smart&auto=webp&s=9ba0fe31d9094fd2a5f9e517f40c6c66d5af6657",Tech,509,0.5719,Positive,0.07224,Neutral
reddit,"Laser tool cleans vintage aircraft in days, not months with much less hazard to health.",laser tool cleans vintage aircraft in days not months with much less hazard to health,441,6,1lyrkbi,2025-07-13T12:26:40,https://newatlas.com/military/laser-turns-vintage-aircraft-cleaning-from-months-days/,"https://external-preview.redd.it/Boza7m0U3yPb-xuFYEVRTxLMSszw3fjWyNcwh_aIJdA.jpeg?width=140&height=73&crop=140:73,smart&auto=webp&s=9b8846fc150caecb18f89ba86202262c3df8541d",Tech,447,0.0,Neutral,0.0,Neutral
reddit,Lucid absolutely smashes Guinness World Record for the longest EV drive on a single charge,lucid absolutely smashes guinness world record for the longest ev drive on a single charge,1610,130,1ly0ne8,2025-07-12T13:36:37,https://newatlas.com/automotive/lucid-air-electric-vehicle-distance-single-charge-record/,"https://external-preview.redd.it/VXEqkKRxR5shdV_-GSA8qoQVSIO1du9sprGvBIfnBOE.jpeg?width=140&height=73&crop=140:73,smart&auto=webp&s=92d2494a77af50b34b08ce972c730fc6f64ac88a",Tech,1740,0.0,Neutral,0.22801999999999997,Neutral
reddit,Tiny lab-in-a-pill can monitor your gut health from the inside | This wireless pill that tracks your digestive system in real time could revolutionize gut health monitoring,tiny labinapill can monitor your gut health from the inside  this wireless pill that tracks your digestive system in real time could revolutionize gut health monitoring,387,23,1lxxzp8,2025-07-12T11:16:27,https://newatlas.com/imaging-diagnostics/pilltrek-caltech-monitor-gut-health-gi-tract/,"https://external-preview.redd.it/72KcsF1lqwfGWZZQqajXZMxGzKpDtSlmDnuwsbVwxSE.jpeg?width=140&height=73&crop=140:73,smart&auto=webp&s=a0c34e1b2e2831a2554c3b864d2e5d1e4b269b76",Tech,410,0.0,Neutral,0.0030600000000000093,Neutral
reddit,"Brain circuit identified that gives physical pain its emotional sting, explaining why some hurts linger as suffering | The breakthrough challenges our beliefs about how we process pain and may transform chronic pain treatments.",brain circuit identified that gives physical pain its emotional sting explaining why some hurts linger as suffering  the breakthrough challenges our beliefs about how we process pain and may transform chronic pain treatments,1096,46,1lx3puc,2025-07-11T10:48:52,https://newatlas.com/disease/brain-circuit-physical-emotional-pain/,"https://external-preview.redd.it/NkiDmAOOpifS5zP2hDC3Gmcfgkl4b0I-dSQD2ZByQIY.jpeg?width=140&height=73&crop=140:73,smart&auto=webp&s=a4545e50300976491079f315230536e9fcad48c7",Tech,1142,-0.9349,Negative,0.08365999999999998,Neutral
reddit,"Autonomous robot surgeon removes organs with 100% success rate | ""This advancement moves us from robots that can execute specific surgical tasks to robots that truly understand surgical procedures.""",autonomous robot surgeon removes organs with 100 success rate  this advancement moves us from robots that can execute specific surgical tasks to robots that truly understand surgical procedures,1370,192,1lwa2nu,2025-07-10T11:15:02,https://newatlas.com/robotics/worlds-first-robot-surgery/,"https://external-preview.redd.it/4oLVB37oCuhoF-NOzEtpQVzVxLfMbKxSE3OvEJNXhEQ.png?width=140&height=73&crop=140:73,smart&auto=webp&s=f50c17bb4eab3fe6660f67e5c2da41bc6983890c",Tech,1562,0.765,Positive,0.1921,Neutral
reddit,Ancient-fossil bioconcrete traps 142% more carbon – and it’s strong as hell,ancientfossil bioconcrete traps 142 more carbon  and its strong as hell,620,31,1lwchok,2025-07-10T13:17:24,https://newatlas.com/materials/bio-concrete-carbon-diatomaceous-earth/,"https://external-preview.redd.it/nfq-DfdaowEBKkY03pXfuGUC5q5X-IseyvVL46yGXl8.png?width=140&height=73&crop=140:73,smart&auto=webp&s=8ce7b4fab793cc868f0f1ba358fb02e280452b04",Tech,651,-0.3182,Neutral,-0.011540000000000009,Neutral
reddit,"MIT's smart implant dispenses life-saving drug when diabetics need it most | A glucagon implant features a drug reservoir sealed with an alloy that changes shape when heated, so it can dispense its contents on demand",mits smart implant dispenses lifesaving drug when diabetics need it most  a glucagon implant features a drug reservoir sealed with an alloy that changes shape when heated so it can dispense its contents on demand,142,2,1lwa1b2,2025-07-10T11:12:56,https://newatlas.com/medical-tech/mit-hypoglycemia-implant-dispenses-glucagon-diabetes/,"https://external-preview.redd.it/7LhdVKMyeRglbwrjdYAdF5X9iBQaj_obl2phOCKl8Q0.jpeg?width=140&height=73&crop=140:73,smart&auto=webp&s=6b6785c1e5a52a8373c9553a14af8593126ad229",Tech,144,0.296,Neutral,-0.26685000000000003,Neutral
reddit,"Scientists 3D print tumors for cancer research — TissueTinker using 3D bioprinting to create miniature models of healthy and diseased tissue for side-by-side comparison, backed by McGill",scientists 3d print tumors for cancer research  tissuetinker using 3d bioprinting to create miniature models of healthy and diseased tissue for sidebyside comparison backed by mcgill,512,14,1lvjx00,2025-07-09T14:16:17,https://www.tomshardware.com/3d-printing/scientists-3d-print-tumors-for-cancer-research-tissuetinker-using-3d-bioprinting-to-create-miniature-models-of-healthy-and-diseased-tissue-for-side-by-side-comparison-backed-by-mcgill,"https://external-preview.redd.it/a7w3TmRSWm292DBqFTz3Iqfdz1jHQwosceeST-M-lb8.jpeg?width=140&height=78&crop=140:78,smart&auto=webp&s=5b2d1bf0a5952566b5db8b76f7da82602eb1be1d",Tech,526,-0.128,Neutral,-0.27432,Neutral
reddit,"Simple scan lets you slow down aging and even prevent chronic disease | It didn't just predict cognitive impairment, accelerated brain atrophy and conversion to diagnosed dementia, it could also provide a risk factor for physical frailty, poor health, other future chronic diseases and mortality.",simple scan lets you slow down aging and even prevent chronic disease  it didnt just predict cognitive impairment accelerated brain atrophy and conversion to diagnosed dementia it could also provide a risk factor for physical frailty poor health other future chronic diseases and mortality,805,53,1lvfhio,2025-07-09T10:38:28,https://newatlas.com/brain/alzheimers-dementia/single-mri-scan/,"https://external-preview.redd.it/EaZJ5E8qtmrfUekS7q3ySR_IpjwNXDb5ScIpvMxdCZY.png?width=140&height=73&crop=140:73,smart&auto=webp&s=71f8dd064c38c40d048f1432bdae03004a73dd57",Tech,858,-0.6249,Negative,0.23692000000000002,Neutral
reddit,Study shows AI coding assistants actually slow down experienced developers,study shows ai coding assistants actually slow down experienced developers,31,5,1m20api,2025-07-17T06:31:40,https://www.techspot.com/news/108651-experienced-developers-working-ai-tools-take-longer-complete.html,"https://external-preview.redd.it/dTcs-ohazTMJqK9478XgnR3hsQRBUQFqJ9rZDZLM5aE.jpeg?width=140&height=93&crop=140:93,smart&auto=webp&s=036e7896dfe47676c4392cc4826bba04815c33c7",Tech,36,0.0,Neutral,-0.22556666666666667,Neutral
reddit,Hydration sensor alerts wearer to urgent water need,hydration sensor alerts wearer to urgent water need,618,141,1m19l90,2025-07-16T11:00:39,https://newatlas.com/wearables/hydration-sensor-wearable/,"https://external-preview.redd.it/Dso9KKGy0vAdZYR4L98-_yG3qX6JwdPGPTfzS9yePbc.jpeg?width=140&height=73&crop=140:73,smart&auto=webp&s=06ef8553a218ce2f3135e0afdad9e50ca6d13b42",Tech,759,0.2023,Neutral,-0.16866,Neutral
reddit,Scientists develop blood test that reveals how fast your organs are aging | The scientists found that an organ's biological age strongly predicts the risk of related diseases,scientists develop blood test that reveals how fast your organs are aging  the scientists found that an organs biological age strongly predicts the risk of related diseases,344,13,1m1bb9h,2025-07-16T12:30:00,https://www.techspot.com/news/108672-scientists-develop-blood-test-reveals-how-fast-organs.html,"https://external-preview.redd.it/UXNV1SCJES39mkdl84Weu4-JA6OcwCiA7IDuo4-2aqg.jpeg?width=140&height=93&crop=140:93,smart&auto=webp&s=bcdf2919eda032446f4e5d9f3f6de75c6a4beb45",Tech,357,0.0,Neutral,0.15206,Neutral
reddit,One treatable issue could dramatically improve life for adults with ADHD | Study calls for more attention to be paid to how treating sleep disorders can greatly improve wellbeing for people with ADHD.,one treatable issue could dramatically improve life for adults with adhd  study calls for more attention to be paid to how treating sleep disorders can greatly improve wellbeing for people with adhd,1655,204,1m0gmmh,2025-07-15T12:35:57,https://newatlas.com/adhd-autism/adhd-life-satisfaction-insomnia/,"https://external-preview.redd.it/WJIm9Wr3y5qXGN_KA4nQPMCQZ6Ry4Q9f3kIj30lAIGE.jpeg?width=140&height=73&crop=140:73,smart&auto=webp&s=85e4a5ae8ad8df9afb812594da53c6ffe874f6f7",Tech,1859,0.7264,Positive,0.30294,Neutral
reddit,"Alibaba-backed Moonshot releases new Kimi AI model that beats ChatGPT, Claude in coding — and it costs less",alibababacked moonshot releases new kimi ai model that beats chatgpt claude in coding  and it costs less,86,6,1m0wtqw,2025-07-15T23:11:14,https://www.cnbc.com/2025/07/14/alibaba-backed-moonshot-releases-kimi-k2-ai-rivaling-chatgpt-claude.html,"https://external-preview.redd.it/0_FBAWufqqOTn0mcZPRsZJsFSHO9y993GsJn8w3P0XM.jpeg?width=140&height=78&crop=140:78,smart&auto=webp&s=cafff595af1fb98eeaec3b6cd3174240673655c1",Tech,92,0.0,Neutral,0.3612,Neutral
reddit,A prosthesis driven by the nervous system helps people with amputation walk naturally,a prosthesis driven by the nervous system helps people with amputation walk naturally,314,9,1m0hmu0,2025-07-15T13:22:08,https://news.mit.edu/2024/prosthesis-helps-people-with-amputation-walk-naturally-0701,"https://external-preview.redd.it/IFpkhSUflUI5-lIAOq5RCovsOrHA5C7ZZ8Eviih_XPI.jpeg?width=140&height=93&crop=140:93,smart&auto=webp&s=0d65360bbf3910c01eed79de9b213177aef61e08",Tech,323,0.128,Neutral,-0.28615,Neutral
reddit,"Spy-grade storage drive self-destructs on demand just like in the movies | This industrial storage drive for computers and servers can physically destroy itself at the push of a button, so your secrets go up in smoke before they fall into the wrong hands.",spygrade storage drive selfdestructs on demand just like in the movies  this industrial storage drive for computers and servers can physically destroy itself at the push of a button so your secrets go up in smoke before they fall into the wrong hands,173,20,1m0ezti,2025-07-15T11:13:21,https://newatlas.com/computers/team-group-p250q-ssd-self-destructs/,"https://external-preview.redd.it/5i4qkSw2_Isi2y1SBzwsM5kU3xlWhZAqR4eD8ALO77c.jpeg?width=140&height=73&crop=140:73,smart&auto=webp&s=d7a293dd36a06b6cf945d4cc1df8b9f70b357cb1",Tech,193,-0.6808,Negative,-0.20163999999999999,Neutral
